{
  "id": "normalize-wall-skipped",
  "suite": "normalize",
  "description": "A skipped wall time moves forward and warns",
  "refs": [],
  "input": {
    "event": {
      "start": "2026-03-29T02:30[Europe/Paris]"
    },
    "context": {
      "displayZone": "Europe/Paris"
    }
  },
  "expected": {
    "ok": true,
    "allDay": false,
    "start": "2026-03-29T03:30:00+02:00[Europe/Paris]",
    "end": "2026-03-29T04:30:00+02:00[Europe/Paris]",
    "warnings": [
      "wall-time-skipped"
    ],
    "zoneGuessed": false
  }
}
