{
  "id": "dayinfo-paris-spring-2026",
  "suite": "zone-dayinfo",
  "description": "Paris, 29 March 2026: 23 h, 02:00 jumps to 03:00",
  "refs": [
    "FC#3887"
  ],
  "input": {
    "date": "2026-03-29",
    "zone": "Europe/Paris"
  },
  "expected": {
    "start": "2026-03-28T23:00:00Z",
    "end": "2026-03-29T22:00:00Z",
    "lengthMinutes": 1380,
    "kind": "short",
    "transitions": [
      {
        "at": "2026-03-29T01:00:00Z",
        "offsetBefore": "+01:00",
        "offsetAfter": "+02:00",
        "deltaMinutes": 60,
        "wallBefore": "2026-03-29T02:00:00",
        "wallAfter": "2026-03-29T03:00:00",
        "kind": "gap"
      }
    ]
  }
}
