{
  "id": "normalize-strict-zones",
  "suite": "normalize",
  "description": "strictZones makes a guessed zone an error",
  "refs": [],
  "input": {
    "event": {
      "start": "2026-05-01T09:00"
    },
    "context": {
      "displayZone": "Europe/Paris",
      "strictZones": true
    }
  },
  "expected": {
    "ok": false,
    "errors": [
      "zone-defaulted"
    ]
  }
}
