{
  "id": "normalize-null-means-absent",
  "suite": "normalize",
  "description": "JSON null fields are absent",
  "refs": [],
  "input": {
    "event": {
      "start": "2026-05-01",
      "end": null,
      "rrule": null,
      "id": null
    },
    "context": {
      "displayZone": "Europe/Paris"
    }
  },
  "expected": {
    "ok": true,
    "allDay": true,
    "start": "2026-05-01",
    "end": "2026-05-02",
    "warnings": []
  }
}
