{
  "id": "resolve-paris-repeat-earlier",
  "suite": "zone-resolve",
  "description": "The repeated 02:30, first reading",
  "refs": [],
  "input": {
    "date": "2026-10-25",
    "time": "02:30",
    "zone": "Europe/Paris",
    "policy": "earlier"
  },
  "expected": {
    "instant": "2026-10-25T00:30:00Z",
    "other": "2026-10-25T01:30:00Z",
    "exists": true,
    "ambiguous": true,
    "offsetMatched": null
  }
}
