{
  "id": "normalize-zoned-keeps-zone",
  "suite": "normalize",
  "description": "A zoned start keeps its own zone, not the display zone",
  "refs": [],
  "input": {
    "event": {
      "start": "2026-03-29T09:00[America/Chicago]"
    },
    "context": {
      "displayZone": "Europe/Paris"
    }
  },
  "expected": {
    "ok": true,
    "allDay": false,
    "start": "2026-03-29T09:00:00-05:00[America/Chicago]",
    "end": "2026-03-29T10:00:00-05:00[America/Chicago]",
    "warnings": [],
    "zoneGuessed": false
  }
}
